{
  "meta_version": 2,
  "build": {
    "date": "2026-10-24T10:36:58Z",
    "commit": "2d0e5d620e37e4d3305dd87019c8fab91379bc4c",
    "branch": "nightly",
    "workflow_run_id": 40086609204
  },
  "toolchain": {
    "python": "3.12.15",
    "pyinstaller": "6.22.3",
    "builder_os": "ubuntu-latest"
  },
  "artifacts": [
    {
      "name": "RunUpdates_1.0.0.deb",
      "type": "deb",
      "os": "linux",
      "arch": "amd64",
      "size": 21750104,
      "sha256": "b7a8b32b039bb89099856c4fef200353e84c47cc1ec2b44e228d69168a9449ad",
      "crc32": "d4610d49"
    }
,
    {
      "name": "RunUpdates_1.0.0.tgz",
      "type": "tgz",
      "os": "linux",
      "arch": "amd64",
      "size": 21866297,
      "sha256": "324240d5135a05073dff102e20fe99e50cd54a098bbffe1bc9d1cec7bb0c66ed",
      "crc32": "2ec09105"
    }
,
    {
      "name": "RunUpdates_1.0.0.x86_64.rpm",
      "type": "rpm",
      "os": "linux",
      "arch": "x86_64",
      "size": 21880534,
      "sha256": "37d014828451b42c9c6144c5cf81a1a52825ef763cbe4c4e4f14dafb7d706106",
      "crc32": "413bf4e9"
    }
,
    {
      "name": "RunUpdates_1.0.0.zip",
      "type": "zip",
      "os": "windows",
      "arch": "x86_64",
      "size": 21867986,
      "sha256": "ed820290d6dcd01eacef3ca01593bb37f026933d4ba049a6c205ee3a489cef15",
      "crc32": "00a432c7"
    }
  ]
}
